{
  "product_id": "55002",
  "name": "Фитнес-браслет PulseFit 3",
  "description": "Умный фитнес-браслет с мониторингом пульса, SpO2, стресса и 14-дневным зарядом батареи.",
  "price": {
    "amount": 2199.00,
    "currency": "RUB"
  },
  "category": "Электроника",
  "brand": "PulseFit",
  "stock": {
    "available": 330,
    "reserved": 40
  },
  "sku": "PF-55002",
  "tags": ["фитнес", "браслет", "здоровье", "спорт"],
  "images": [
    {
      "url": "https://example.com/images/product6.jpg",
      "alt": "PulseFit 3 - вид спереди"
    },
    {
      "url": "https://example.com/images/product6_worn.jpg",
      "alt": "PulseFit 3 - на руке"
    }
  ],
  "specifications": {
    "weight": "28g",
    "dimensions": "245mm x 18mm x 10mm",
    "battery_life": "14 days",
    "water_resistance": "IP68"
  },
  "created_at": "2024-05-20T09:00:00Z",
  "updated_at": "2025-03-01T16:45:00Z",
  "index": "products",
  "store_id": "store_001"
}
