{
  "product_id": "11223",
  "name": "Механическая клавиатура TypeMaster Pro",
  "description": "Игровая механическая клавиатура с RGB-подсветкой, переключателями Cherry MX Red и алюминиевым корпусом.",
  "price": {
    "amount": 12990.00,
    "currency": "RUB"
  },
  "category": "Периферия",
  "brand": "TypeMaster",
  "stock": {
    "available": 42,
    "reserved": 5
  },
  "sku": "TM-11223",
  "tags": ["клавиатура", "игровая", "механическая", "rgb"],
  "images": [
    {
      "url": "https://example.com/images/product3.jpg",
      "alt": "TypeMaster Pro - вид сверху"
    },
    {
      "url": "https://example.com/images/product3_side.jpg",
      "alt": "TypeMaster Pro - вид сбоку"
    }
  ],
  "specifications": {
    "weight": "980g",
    "dimensions": "440mm x 135mm x 38mm",
    "battery_life": "wired",
    "water_resistance": "none"
  },
  "created_at": "2024-06-10T08:00:00Z",
  "updated_at": "2025-01-05T14:20:00Z",
  "index": "products",
  "store_id": "store_001"
}
